DATA_MANAGE_NO,DATA_TITLE_NM,THEME_NM,LWPRT_THEME_NM,CL_NM,LWPRT_CL_NM,SBJT_NM,MIDDL_SBJT_NM,SUMRY_CN,MAIN_THUMB_URL,CNTNTS_URL,CTPRVN_NM,SIGNGU_NM,ADDR,CTLSTT_LA,CTLSTT_LO,REGIST_DE,RELATE_PRSN_NM,RELATE_STRY_NM,CORE_KWRD_CN,OPN_DE
1939,"도연명의 귀거래사를 꿈꾸는, 고양 귀래정",역사문화유산,누정,문화유산,건축유적,그림 속의 누정,,귀래정은 경기도 고양시 덕양구 지금의 행주산성 뒤편인 덕양산 기슭의 행호강변(현재 창릉천변)에 있었던 조선시대의 정자이다. 조선후기의 문신 김광욱이 도연명의 귀거래사를 흠모하여 지은 정자이다. 이후 김광욱의 증손이자 겸재 정선의 친구인 김시민이 소유하게 되었다. 당대 유명 시인 이병연과 더불어 정선이 귀래정을 즐겨 방문하여 그림으로 남겨 놓았다. 낙건정·장밀헌과 함께 행주의 3대 별장 중의 하나이었다.,,https://ncms.nculture.org/pavilion/story/2294,경기도,고양시,경기도 고양시 덕양구 덕양산,37.6372458,126.8322044,20181116,김원효,,"누정, 누각, 정자, 귀래정, 정선, 행호, 행주, 김광욱, 도연명, 귀거래사, 율리, 김시민, 귀래정도, 경교명승첩, 양천팔경첩, 김창협, 김창흡, 이병연, 낙건정, 장밀헌, 김동필, 송인명, 행호관어, 덕양산",20211230
1940,탄광문학의 개념,산업,탄광,경제와 산업,광공업,탄광 문화 예술과 축제,탄광의 문화예술,"탄광문학은 탄광노동현실을 인식하는 현장과 탄광노동자의 노동현실, 탄광촌의 실생활 등을 다룬 문학작품을 의미한다. 탄광문학은 지하 공간이라는 탄광 노동 작업장의 특수한 측면이라든가, 광업소를 중심으로 탄광촌이라는 하나의 도시가 형성된 집단이라는 특수한 상황을 통해 생산되었다. 탄광문학 작품이 대거 양산되기 시작한 것은 1980년대부터의 일이다.",,https://ncms.nculture.org/coalmine/story/3796,,,,,,20181116,김월준,,"탄광문학, 탄광시, 탄광노동자, 탄광촌, 탄광촌문학, 탄광시집, 탄광소설",20211230
1941,"소나무의 절개와 절벽의 굳센 기상을 간직한, 대전 송애당",역사문화유산,누정,문화유산,건축유적,사대부의 누정,가옥의 누정,"송애당은 대전광역시 대덕구 계족산로17번길 60(중리동)에 있는 조선시대의 정자이다. 대전광역시유형문화재 제8호이다. 조선후기의 문신·학자 김경여(1597~1653)가 병자호란 때 청나라와 화의하자 비분강개하여 벼슬을 버리고 고향으로 돌아와 1640년(인조 18)에 본가 옆에 별당으로 건립하였다. 이후 화재로 소실되었다가, 1790년(정조 14)에 옛터에 중수하였으며, 이후 1889년(고종 26)에 다시 중수되었다. 주변에 소나무가 많아서 당호를 송애당",https://minio.nculture.org/amsweb-opt/multimedia_assets/239/17039/17969/c/17039-thumb.jpg,https://ncms.nculture.org/pavilion/story/2367,대전광역시,대덕구,대전광역시 대덕구 중리동 계족산로 17번길 60,36.364603,127.432878,20181116,김위,"여름날 배롱나무와 어우러진, 임실 만취정|이진사댁 문제를 해결한 안성군수 김위","김경여, 별당, 송시열, 송준길, 김장생, 동춘당, 쌍청당, 제월당, 비래암, 윤문거, 유계, 호서삼학, 김익희, 법천석총, 기호지역의 별당 송애당",20211230
1942,"여름날 배롱나무와 어우러진, 임실 만취정",역사문화유산,누정,문화유산,건축유적,사대부의 누정,강호 해안의 누정,"임실 만취정(晩翠亭)은 김위(金偉 ; 1532∼1595)가 1572년(선조 5) 낙향하여 세운 정자이다. 정자의 이름은 김위의 호 ‘만취(晩翠)’에서 따온 것이다. ‘만취’는 ‘겨울에도 변하지 않는 초목의 푸른빛’이라는 의미이다. 김위는 재상의 반열에 오른 것은 아니지만 여러 고을의 수령이 되어 선정을 베풀었고, 당대의 고봉 기대승·율곡 이이·백호 임제와 같은 인물과 교유하였다. 만취정에는 이들의 현판이 지금도 걸려있다.",https://minio.nculture.org/amsweb-opt/pdfs/218/27377/27377_thumbnail.JPG,https://ncms.nculture.org/pavilion/story/2356,전라북도,임실군,전라북도 임실군 삼계면 산수리 234,35.479321,127.279752,20181116,김위,"소나무의 절개와 절벽의 굳센 기상을 간직한, 대전 송애당|이진사댁 문제를 해결한 안성군수 김위","정자, 임실, 만취정, 김위, 기대승, 이이",20211230
1943,이진사댁 문제를 해결한 안성군수 김위,생활문화,지역설화,"구비전승,어문학",어문학,서울·경기도·인천 지역의 전설,,"조선시대 숙종 때의 일이다. 경상북도 안동에 ‘김위’라는 선비가 과거를 보기 위해 한양으로 향하던 중 안성에서 이진사댁에 머무른다. 이진사는 3년 전에 외아들이 실종된 상태였다. 김위는 이진사댁에서 지었던 시로 과거에 급제를 하고 안성군수로 내려온다. 안성군수가 된 김위는 사건을 조사하는 과정에서 이진사 아들을 죽인 범인을 잡고, 아들 시신을 찾아준다.",,https://ncms.nculture.org/traditional-stories/story/225,경기도,안성시,경기도 안성시 보개면 238-1,37.01808505,127.3123113,20181116,김위,"소나무의 절개와 절벽의 굳센 기상을 간직한, 대전 송애당|여름날 배롱나무와 어우러진, 임실 만취정","안성시, 설화, 안성군수, 김위, 살인사건, 이진사",20211230
1944,"정선의 그림에 보이는 즐겁고 건강하게 살자는, 고양 낙건정",역사문화유산,누정,문화유산,건축유적,그림 속의 누정,,낙건정은 경기도 고양시 덕양구 행주외동 덕양산 끝자락 절벽 위에 있었던 조선시대의 정자이다. 1721년에 조선후기의 문신 김동필이 벼슬에서 물러나 건강하고 즐겁게 살기 위하여 지은 정자이다. 낙건정이란 정자 이름은 송나라 대학자 구양수의 「사영시(思潁詩)」 중 ‘몸이 건강해야 비로소 즐겁게 되니 늙고 병들어 부축하기를 기다리지 말라.’는 시구에서 따왔다. 현재 낙건정은 사라지고 없으나 1742년에 겸재 정선이 그린 「낙건정도」를 통해 그 모습을 알 수,,https://ncms.nculture.org/pavilion/story/2438,경기도,고양시,경기도 고양시 덕양구 행주외동,37.6051683,126.8141072,20181116,김유,"오천 군자마을의 풍류 공간, 안동 탁청정|두부와 두부행상|제원도의 중심 제원역|태평성세를 염원하는 백성들이 만든 탕평채, 영주 태평초|제주의 푸른 바다를 품은 식품, 둠비|귀한 손님 접대와 제사상에 올렸던 양반의 음식, 안동 건진국수|명절과 잔치의 단골음식, 담양 동아정과|식혜는 색이 뽀얗고 맛이 달다는 상식을 뛰어넘다, 안동식혜|병자호란의 아픔이 담긴 서울 홍제동|가장 오래된 종가 음식 조리서, 경북 안동 수운잡방|인조반정을 기념하는 서울 은평구 인조","낙건정, 낙건정도, 누정, 덕양산, 양천팔경첩, 누각, 정자, 정선, 행호, 행주, 김동필, 김창흡, 구양수, 사영시, 이덕수, 이병연, 김광수, 행호관어, 경교명승첩, 김광욱, 송인명, 귀래정, 장밀헌, 행주별장",20211230
1945,"오천 군자마을의 풍류 공간, 안동 탁청정",역사문화유산,누정,문화유산,건축유적,사대부의 누정,마을과 들녘의 누정,"탁청정은 경상북도 안동시 와룡면 군자리길 21(오천리)에 있는 조선시대의 정자이다. 국가민속문화재 제226호이다. 탁청정(濯淸亭) 김유(金綏:1491~1552)가 1541년(중종 36)에 광산김씨 종가를 지으며 부속으로 종가에 딸린 정자로서 건립하였다. 원래는 낙동강에 인접한 오천리(외내)에 있었으나 안동댐 건설로 인해 1974년에 오천 문화재단지 내인 현 위치로 이건하였다. 정자 주인의 넉넉한 인정으로 이황, 이천보, 황준량, 정윤목 등 당대의 명현들",https://minio.nculture.org/amsweb-opt/multimedia_assets/31/17839/17620/c/17839-thumb.jpg,https://ncms.nculture.org/pavilion/story/2393,경상북도,안동시,경상북도 안동시 와룡면 군자리길 21(오천리),36.673477,128.803086,20181116,김유,"정선의 그림에 보이는 즐겁고 건강하게 살자는, 고양 낙건정|두부와 두부행상|제원도의 중심 제원역|태평성세를 염원하는 백성들이 만든 탕평채, 영주 태평초|제주의 푸른 바다를 품은 식품, 둠비|귀한 손님 접대와 제사상에 올렸던 양반의 음식, 안동 건진국수|명절과 잔치의 단골음식, 담양 동아정과|식혜는 색이 뽀얗고 맛이 달다는 상식을 뛰어넘다, 안동식혜|병자호란의 아픔이 담긴 서울 홍제동|가장 오래된 종가 음식 조리서, 경북 안동 수운잡방|인조반정을 기념하는","누정, 정자, 누각, 김유, 광산김씨종가, 이황, 이천보, 황준량, 정윤목, 김연, 수운잡방, 김령, 탁청정종가, 오천유적지, 한호, 오천군자마을, 예안파종가, 후조당, 계암정, 읍청정",20211230
1946,두부와 두부행상,역사문화유산,근대문화유산,생활과 민속,생활,근대 신문으로 보는 음식,전통 음식과 식재료의 변화,"일제강점기 한국에서 농사지은 콩의 1/3 이상이 일본으로 수출되었지만, 만주산 콩이 한국으로 다량 수입되면서 한국인들은 두부를 많이 만들 수 있었다. 두부는 한번 만드는데 손이 많이 가므로 집에서 만들지 않고 전문적인 제조소에서 만들었는데, 짧은 유통기한으로 인해 두부 행상이 반드시 필요했다. 인천에서는 두부행상들의 파업이 일어나기도 했다. 두부 만드는데 쓰이는 간수를 우물물로 쓰기도 했는데, 우물물이 오염된 경우가 많아 위생검사에서 걸리곤 했다.&nb",https://minio.nculture.org/amsweb-opt/multimedia_assets/167/14766/19996/c/14766-thumb.jpg,https://ncms.nculture.org/legacy/story/2760,,,경상북도 영주시 부석면 영부로 23 영주 콩세계 과학관,36.994877,128.664093,20181116,김유,"정선의 그림에 보이는 즐겁고 건강하게 살자는, 고양 낙건정|오천 군자마을의 풍류 공간, 안동 탁청정|제원도의 중심 제원역|태평성세를 염원하는 백성들이 만든 탕평채, 영주 태평초|제주의 푸른 바다를 품은 식품, 둠비|귀한 손님 접대와 제사상에 올렸던 양반의 음식, 안동 건진국수|명절과 잔치의 단골음식, 담양 동아정과|식혜는 색이 뽀얗고 맛이 달다는 상식을 뛰어넘다, 안동식혜|병자호란의 아픔이 담긴 서울 홍제동|가장 오래된 종가 음식 조리서, 경북 안동 수","두부, 만주산 콩, 우물물, 두부제조소, 두부행상",20211230
1947,제원도의 중심 제원역,역사문화유산,성과옛도로,자연과 지리,향토지,옛 도로,역도를 관장하던 찰방역,"제원역은 조선시대 전라도 금산(지금의 충청남도 금산군)을 중심으로 형성되었던 제원도의 중심이 되는 찰방역이었으며, 전라북도 동부의 산악구간으로 뻗어 있던 교통로를 관할했다. 제원역이 관할하던 역은 모두 4개였다. 지금의 충청남도 금산군 제원면에는 제원역에 부임했던 찰방을 기리는 비가 세워져 있으며, 역에 있던 말을 씻기던 세마지가 남아 있다. 제원역은 1894년에 발생한 동학운동 때에 전라북도 고창에서보다 이른 시기에 동학군이 모여 일본군에 맞서 싸웠던",https://minio.nculture.org/amsweb-opt/multimedia_assets/170/11610/19547/c/11610-thumb.jpg,https://ncms.nculture.org/castle-road/story/2057,충청남도,금산군,충청남도 금산군 제원면 제원리 200번지,36.113661,127.545615,20181116,김유,"정선의 그림에 보이는 즐겁고 건강하게 살자는, 고양 낙건정|오천 군자마을의 풍류 공간, 안동 탁청정|두부와 두부행상|태평성세를 염원하는 백성들이 만든 탕평채, 영주 태평초|제주의 푸른 바다를 품은 식품, 둠비|귀한 손님 접대와 제사상에 올렸던 양반의 음식, 안동 건진국수|명절과 잔치의 단골음식, 담양 동아정과|식혜는 색이 뽀얗고 맛이 달다는 상식을 뛰어넘다, 안동식혜|병자호란의 아픔이 담긴 서울 홍제동|가장 오래된 종가 음식 조리서, 경북 안동 수운잡방","제원도, 찰방, 세마지, 어풍대, 동학운동",20211230
1948,"태평성세를 염원하는 백성들이 만든 탕평채, 영주 태평초",생활문화,향토음식,생활과 민속,생활,향토음식의 유래와 역사,,태평초는 태평추로 불리기도 하며 메밀묵에 묵은 김치와 돼지고기를 넣고 끓여낸 전골의 일종으로 조선의 21대 국왕 영조(英祖)의 탕평정책을 상징하는 음식인 탕평채에서 유래된 것으로 알려진 경상북도 영주시의 향토음식이다.,,https://ncms.nculture.org/food/story/1728,경상북도,영주시,경상북도 영주시 순흥면,36.91565,128.575052,20181116,김유,"정선의 그림에 보이는 즐겁고 건강하게 살자는, 고양 낙건정|오천 군자마을의 풍류 공간, 안동 탁청정|두부와 두부행상|제원도의 중심 제원역|제주의 푸른 바다를 품은 식품, 둠비|귀한 손님 접대와 제사상에 올렸던 양반의 음식, 안동 건진국수|명절과 잔치의 단골음식, 담양 동아정과|식혜는 색이 뽀얗고 맛이 달다는 상식을 뛰어넘다, 안동식혜|병자호란의 아픔이 담긴 서울 홍제동|가장 오래된 종가 음식 조리서, 경북 안동 수운잡방|인조반정을 기념하는 서울 은평구","경상북도, 영주시, 향토음식, 태평초, 탕평채, 순흥, 금성대군, 정희량, 탕평책",20211230
1949,"제주의 푸른 바다를 품은 식품, 둠비",생활문화,향토음식,생활과 민속,생활,지역 향토 음식,,둠비는 생콩을 갈아 끓이면서 제주 앞바다의 해수를 응고제로 사용하여 엉기게 한 후 틀에 부어 눌러 놓았다가 단단하게 만든 제주특별자치도 특유의 전통 두부이다. 둠비는 두부의 제주 방언으로 '마른 두부'라고도 부른다. 육지의 두부보다 콩의 향량이 높아 단단한 둠비는 제주도의&nbsp;경조사와 제례 때 빠지지 않는 음식이기도 하다.,https://minio.nculture.org/amsweb-opt/multimedia_assets/4/85699/92714/c/%EB%91%A0%EB%B9%84-%288%29_rev-thumb.jpg,https://ncms.nculture.org/food/story/1734,제주특별자치도,제주시,제주특별자치도 제주시 중앙로 2,33.51814757,126.5239547,20181116,김유,"정선의 그림에 보이는 즐겁고 건강하게 살자는, 고양 낙건정|오천 군자마을의 풍류 공간, 안동 탁청정|두부와 두부행상|제원도의 중심 제원역|태평성세를 염원하는 백성들이 만든 탕평채, 영주 태평초|귀한 손님 접대와 제사상에 올렸던 양반의 음식, 안동 건진국수|명절과 잔치의 단골음식, 담양 동아정과|식혜는 색이 뽀얗고 맛이 달다는 상식을 뛰어넘다, 안동식혜|병자호란의 아픔이 담긴 서울 홍제동|가장 오래된 종가 음식 조리서, 경북 안동 수운잡방|인조반정을 기념","둠비, 제주도, 두부, 마른두부, 향토음식",20211230
1950,"귀한 손님 접대와 제사상에 올렸던 양반의 음식, 안동 건진국수",생활문화,향토음식,생활과 민속,생활,향토음식의 유래와 역사,,"건진국수는 밀가루에 생콩가루를 섞어 반죽한 것을 얇고 가늘게 썰어 삶아낸 다음 찬물에 헹구어 그릇에 담아 닭 육수를 붓고 가늘게 찢어 놓은 닭살, 채 썰어서 볶아 놓은 애호박과 석이, 계란지단을 고명으로 얹어낸 경상북도 안동시의 향토음식이다.",,https://ncms.nculture.org/food/story/1758,경상북도,안동시,경북 안동시 서동문로 203(동부동),36.5663122,128.7343304,20181116,김유,"정선의 그림에 보이는 즐겁고 건강하게 살자는, 고양 낙건정|오천 군자마을의 풍류 공간, 안동 탁청정|두부와 두부행상|제원도의 중심 제원역|태평성세를 염원하는 백성들이 만든 탕평채, 영주 태평초|제주의 푸른 바다를 품은 식품, 둠비|명절과 잔치의 단골음식, 담양 동아정과|식혜는 색이 뽀얗고 맛이 달다는 상식을 뛰어넘다, 안동식혜|병자호란의 아픔이 담긴 서울 홍제동|가장 오래된 종가 음식 조리서, 경북 안동 수운잡방|인조반정을 기념하는 서울 은평구 인조별서","건진국수, 안동국시, 건진국시, 국수, 안동시, 경상북도, 향토음식",20211230
1951,"명절과 잔치의 단골음식, 담양 동아정과",생활문화,향토음식,생활과 민속,생활,향토음식의 유래와 역사,,"동아정과는 굴 또는 꼬막 껍데기를 태워 재로 만든 사회가루에 묻어서 조직이 단단해진 동아의 과육을 꿀이나 조청, 설탕 등에 조려낸 전라도 지역의 대표적인 한과이다. 역사가 오래된 식재료인 만큼 동아는 서민의 반찬에서부터 왕실의 제수(祭需)에 이르기까지 다양하게 이용되었다.",,https://ncms.nculture.org/food/story/1827,전라남도,담양군,전남 담양군 담양읍 죽향문화로 35,35.3095245,126.9772194,20181116,김유,"정선의 그림에 보이는 즐겁고 건강하게 살자는, 고양 낙건정|오천 군자마을의 풍류 공간, 안동 탁청정|두부와 두부행상|제원도의 중심 제원역|태평성세를 염원하는 백성들이 만든 탕평채, 영주 태평초|제주의 푸른 바다를 품은 식품, 둠비|귀한 손님 접대와 제사상에 올렸던 양반의 음식, 안동 건진국수|식혜는 색이 뽀얗고 맛이 달다는 상식을 뛰어넘다, 안동식혜|병자호란의 아픔이 담긴 서울 홍제동|가장 오래된 종가 음식 조리서, 경북 안동 수운잡방|인조반정을 기념하","동아정과, 담양군, 전라남도, 동아, 정과, 향토음식",20211230
1952,"식혜는 색이 뽀얗고 맛이 달다는 상식을 뛰어넘다, 안동식혜",생활문화,향토음식,생활과 민속,생활,특별한 날에 먹는 전통음식,,"안동식혜는 찹쌀로 지은 고두밥에 엿기름, 무, 고춧가루, 생강, 물을 재료로 하여 따뜻한 곳에서 발효시킨 전통음료이다. 식혜라는 명칭을 사용하고 있지만, 일반적으로 알려진 단맛의 감주와는 달리 재료에서 우러난 알싸한 향과 매콤하고 얼큰한 맛을 지닌 안동과 안동문화권에 속한 경북북부지방에만 있는 경상북도 안동시의 향토음식이다.",https://minio.nculture.org/amsweb-opt/multimedia_assets/160/25669/7432/c/25669-thumb.jpg,https://ncms.nculture.org/food/story/1929,경상북도,안동시,경북 안동시 서동문로 203(동부동),36.5663122,128.7343304,20181116,김유,"정선의 그림에 보이는 즐겁고 건강하게 살자는, 고양 낙건정|오천 군자마을의 풍류 공간, 안동 탁청정|두부와 두부행상|제원도의 중심 제원역|태평성세를 염원하는 백성들이 만든 탕평채, 영주 태평초|제주의 푸른 바다를 품은 식품, 둠비|귀한 손님 접대와 제사상에 올렸던 양반의 음식, 안동 건진국수|명절과 잔치의 단골음식, 담양 동아정과|병자호란의 아픔이 담긴 서울 홍제동|가장 오래된 종가 음식 조리서, 경북 안동 수운잡방|인조반정을 기념하는 서울 은평구 인조","경상북도, 안동시, 향토음식, 안동식혜, 식혜, 전통음료",20211230
1953,병자호란의 아픔이 담긴 서울 홍제동,생활문화,지명유래,"구비전승,어문학",지명유래,서울 지역의 지명유래,,"서울시 서대문구 홍제동(弘濟洞)은 홍제원에서 온 지명이다. 백성을 널리 구제한다는 뜻을 가진 홍제원은 역원 중의 하나로 공무여행자들의 숙소였다. 조선시대 동대문 밖의 보제원(普濟院), 광희문 밖의 전관원(箭串院), 이태원(梨泰院), 홍제원(弘濟院)이 4대원으로 불렸다. 병자호란 이후 청에 끌려갔다 돌아온 여인들에게 홍제원의 냇물에 몸을 씻고 오면 정절에 대해 말하지 않겠다는 인조 임금의 영이 내려진 곳이기도 하다.",https://minio.nculture.org/amsweb-opt/multimedia_assets/206/72081/64620/c/전쟁의-아픔이-담긴-서울시-서대문구-홍제동-thumb.jpg,https://ncms.nculture.org/origin-of-place-names/story/454,서울특별시,서대문구,서울특별시 서대문구 통일로34길 27,37.58617764,126.9493568,20181116,김유,"정선의 그림에 보이는 즐겁고 건강하게 살자는, 고양 낙건정|오천 군자마을의 풍류 공간, 안동 탁청정|두부와 두부행상|제원도의 중심 제원역|태평성세를 염원하는 백성들이 만든 탕평채, 영주 태평초|제주의 푸른 바다를 품은 식품, 둠비|귀한 손님 접대와 제사상에 올렸던 양반의 음식, 안동 건진국수|명절과 잔치의 단골음식, 담양 동아정과|식혜는 색이 뽀얗고 맛이 달다는 상식을 뛰어넘다, 안동식혜|가장 오래된 종가 음식 조리서, 경북 안동 수운잡방|인조반정을 기","홍제동, 백성구제, 병자호란",20211230
1954,"가장 오래된 종가 음식 조리서, 경북 안동 수운잡방",역사문화유산,한국의 기록문화,문화유산,기타,경상도 대구 울산 부산의 기록문화,종이자료,"경상북도 안동시 한국국학진흥원에는 수운잡방이라는 음식 조리서가 소장되어 있다. 김유와 김령이 지은 한 권 분량의 책으로 술, 국수, 김치, 과자 등 다양한 음식을 만드는 법이 기록되어 있다. 일반인이 저술한 최초의 음식 관련 서적으로 조선 전기 경상북도 안동시의 식생활 문화를 살펴볼 수 있는 귀중한 자료이다. 수운잡방에 관한 관심은 현재까지도 이어져 수운잡방연구원에 방문하면 음식을 조리하고 맛보는 체험도 할 수 있다.",https://minio.nculture.org/amsweb-opt/multimedia_assets/28/72412/65443/c/수운잡방_문화재청_제4유형-(1)-thumb.jpg,https://ncms.nculture.org/archival/story/5204,경상북도,안동시,경북 안동시 포도길 12,36.56875989,128.7081774,20181116,김유,"정선의 그림에 보이는 즐겁고 건강하게 살자는, 고양 낙건정|오천 군자마을의 풍류 공간, 안동 탁청정|두부와 두부행상|제원도의 중심 제원역|태평성세를 염원하는 백성들이 만든 탕평채, 영주 태평초|제주의 푸른 바다를 품은 식품, 둠비|귀한 손님 접대와 제사상에 올렸던 양반의 음식, 안동 건진국수|명절과 잔치의 단골음식, 담양 동아정과|식혜는 색이 뽀얗고 맛이 달다는 상식을 뛰어넘다, 안동식혜|병자호란의 아픔이 담긴 서울 홍제동|인조반정을 기념하는 서울 은평","김유, 김령, 수운잡방, 한국국학진흥원, 수운잡방연구원",20211230
1955,인조반정을 기념하는 서울 은평구 인조별서유기비,역사문화유산,한국의 기록문화,문화유산,기타,서울의 기록문화,금석자료,서울 은평구 역촌동에는 인조가 왕위에 오르기 전에 머물렀던 별서를 기념하기 위해 세운 인조별서유기비가 있다. 인조는 별서에서 반정을 계획하고 1623년에 실행에 옮겨 광해군을 축출하는 데 성공하였다. 비석에 새겨진 내용을 통해 서울시 은평구 연신내 일대가 인조반정의 주된 무대였다는 것을 알 수 있다. 인조별서유기비는 그 가치를 인정받아 2006년 2월 17일 보물 제1462호로 지정되었다.,,https://ncms.nculture.org/archival/story/5433,서울특별시,은평구,역촌동 8-12번지,37.60874582,126.9166277,20181116,김유,"정선의 그림에 보이는 즐겁고 건강하게 살자는, 고양 낙건정|오천 군자마을의 풍류 공간, 안동 탁청정|두부와 두부행상|제원도의 중심 제원역|태평성세를 염원하는 백성들이 만든 탕평채, 영주 태평초|제주의 푸른 바다를 품은 식품, 둠비|귀한 손님 접대와 제사상에 올렸던 양반의 음식, 안동 건진국수|명절과 잔치의 단골음식, 담양 동아정과|식혜는 색이 뽀얗고 맛이 달다는 상식을 뛰어넘다, 안동식혜|병자호란의 아픔이 담긴 서울 홍제동|가장 오래된 종가 음식 조리서","인조, 광해군, 인조 반정, 연신내, 별서",20211230
