DATA_MANAGE_NO,DATA_TITLE_NM,THEME_NM,LWPRT_THEME_NM,CL_NM,LWPRT_CL_NM,SBJT_NM,MIDDL_SBJT_NM,SUMRY_CN,MAIN_THUMB_URL,CNTNTS_URL,CTPRVN_NM,SIGNGU_NM,ADDR,CTLSTT_LA,CTLSTT_LO,REGIST_DE,RELATE_PRSN_NM,RELATE_STRY_NM,CORE_KWRD_CN,OPN_DE
2295,"무오사화와 기묘사화의 산물인, 청도 삼족대",역사문화유산,누정,문화유산,건축유적,사대부의 누정,강호 해안의 누정,"청도 삼족대는 1519년 김대유가 낙향하여 지은 정자이다. 그는 김일손의 조카로 조광조·주세붕·조식 등과 교우했던 인물이다. 그는 김일손의 ‘조의제문’으로 발단된 무오사화에서 아버지와 함께 유배 생활하였고, 다시 기묘사화로 낙향하여 삼족대에서 후학을 양성하며 지냈다. 인근의 박하담과 함께 사창(社倉) 설치를 주도하여 삼족대 아래의 동창천(東倉川) 이름도 여기서 기인하였다. 영남학파의 거두 남명 조식이 삼족대에 자주 방문하여 여러 편의 시를 남겼다.",https://minio.nculture.org/amsweb-opt/multimedia_assets/235/16991/3388/c/16991-thumb.jpg,https://ncms.nculture.org/pavilion/story/2288,경상북도,청도군,경상북도 청도군 매전면 금곡리,35.674956,128.86716,20181116,김준손,,"삼족대, 김대유, 누정, 정자, 청도, 조식",20211230
2296,"덕진이 세운 영암천의 다리, 전남 영암군 덕진교비",역사문화유산,한국의 기록문화,문화유산,기타,전라도 광주의 기록문화,금석자료,전라남도 영암군에는 덕진이라는 여인의 업적을 기리기 위해 1813년에 세운 비석이 있다. 이 비석은 통일신라 때 영암천변 주변에서 주막집을 운영하던 덕진이 강에 다리가 없어 불편해하는 손님과 마을 사람들을 위해 헌신한 이야기가 함께 전한다. 덕진 이야기는 덕진면에 살고 있던 주민들이 다른 사람을 위해 선행을 베푼 덕진의 숭고한 정신을 오랫동안 기억하고 교훈으로 삼고자 만들어낸 것으로 보인다.,,https://ncms.nculture.org/archival/story/5075,전라남도,영암군,전남 영암군 덕진면 내촌길 40,34.81817231,126.6941504,20181116,김준철,,"전라남도, 영암군, 영암천, 덕진교비",20211230
2297,참여시와 저항시를 쓴 시인 조태일,생활문화,지역문화예술인,종교와 문화,문화예술,문학,,"전남 곡성 태생의 시인 조태일은 1964년에 등단한 후 1970년대에 독재에 저항하다 여러 번 투옥되었고, 1980년부터 3년간 수감생활을 했던 저항시인이자 참여시인이다. 초기에는 순수시를 썼으나 점차 폭력에 맞서는 참여시를 썼다. 시집 『아침 선박』, 『식칼론』, 『자유가 시인더러』, 『풀잎은 꺾이지 않는다』 등이 있다. 『시인』을 창간하여 김지하, 양성우 등을 발굴하기도 했다. 전남 곡성 태안사 근처에 조태일시문학관이 있다.",https://minio.nculture.org/amsweb-opt/3ds/108/84463/84463_thumbnail.jpg,https://ncms.nculture.org/local-artist/story/1100,전라남도,곡성군,전남 곡성군 죽곡면 태안로 622-38,35.13351624,127.368594,20181116,김준태,,"시인, 광주대학교, 식칼론, 곡성, 아침선박, 조태일시문학관",20211230
2298,"논개의 얼이 서려 있는 조선 삼대 누각, 진주 촉석루",역사문화유산,누정,문화유산,건축유적,사대부의 누정,가옥의 누정,"촉석루(矗石樓)는 경상남도 진주시 남강로 626(본성동)에 있는 누각이다. 경상남도 문화재자료 제8호로 지정되어 있다. 진주 남강(南江)가 바위 벼랑 위에 장엄하게 자리 잡고 있는 촉석루는 규모가 크고 건물이 아름다우며 주변 풍경도 절경이어서 예로부터 명루(名樓)로 꼽혔다. 경복궁의 경회루(慶會樓), 평양의 부벽루(浮碧樓)와 함께 ‘조선의 3대 누각’으로 불리었고, 부벽루와 밀양의 영남루(嶺南樓), 삼척의 죽서루(竹西樓)와 함께 ‘한국의 4대 누각’,",https://minio.nculture.org/amsweb-opt/multimedia_assets/68/18301/18097/c/18301-thumb.jpg,https://ncms.nculture.org/pavilion/story/2327,경상남도,진주시,경상남도 진주시 남강로 626(본성동),35.189494,128.081888,20181116,김중광,"진주 촉석루, 임란 의병과 '논개'가 떠오르는 누정|김시민 장군의 3대첩이 이루어진 진주성","누정, 정자, 누각, 남강, 진주, 백문보, 용두사, 김지대, 김준, 안진, 장원루, 김중광, 남장대, 정을보, 권충, 박시결, 단영, 하륜, 경임, 오치인, 신점, 하수일, 남이흥, 이태망, 논개, 진주성, 정현복, 오제봉, 정명수, 박융, 하연, 한몽삼, 강대수, 정이오, 김성일, 여동식, 강렴, 정문부, 하진, 정식, 성환혁, 진주대첩, 의암, 촉석루연회도, 안중식",20211230
2299,"진주 촉석루, 임란 의병과 '논개'가 떠오르는 누정",역사문화유산,누정,문화유산,건축유적,"궁궐, 관아의 누정",관아의 누정,"우리나라의 3대 누각 중 하나인 진주 촉석루(矗石樓)하면 먼저 연상되는 인물이 있다. 바로 ‘논개’다. 진주성은 임진왜란 3대 전투에 속하는 진주대첩의 장소로, 당시 치열한 전투가 벌어졌지만 결국 진주성은 함락되었고, 승전을 자축하는 연회에서 ‘논개’가 적장을 끌어안고 남강으로 몸을 던졌다. 그래서 진주하면 ‘임진왜란-촉석루-논개’가 꼬리표처럼 따라다닌다. 촉석루를 노래했던 문인들의 감흥도 임진왜란이 발발한 전후로 크게 달라졌음을 알 수 있다.",https://minio.nculture.org/amsweb-opt/multimedia_assets/18/16008/16710/c/16008-thumb.jpg,https://ncms.nculture.org/pavilion/story/2273,경상남도,진주시,경상남도 진주시 본성동 500-1,35.189441,128.08181,20181116,김중광,"논개의 얼이 서려 있는 조선 삼대 누각, 진주 촉석루|김시민 장군의 3대첩이 이루어진 진주성","촉석루, 진주 촉석루, 논개, 누정, 누각, 진주성",20211230
2300,김시민 장군의 3대첩이 이루어진 진주성,역사문화유산,성과옛도로,자연과 지리,향토지,성과 성곽,산성의 나라 각 지방의 성곽,"남강변 절벽위에 세워진 진주성은 본시 토성이던 것을 고려조 1379년(우왕 5)에 진주목사 김중광(金仲光)이 석축하였다. 둘레는 1.7㎞이다.  원래 백제의 거열성지였다고 전하며 고려 말에는 왜구 방비의 기지였으며 임진왜란 때에는 김시민장군이 왜군을 대파하여 임진란 3대첩의 전승을 이룬 곳이다. 촉석성(矗石城), 진주읍성이라고도 불린다.",https://minio.nculture.org/amsweb-opt/multimedia_assets/39/12245/1145/c/12245-thumb.jpg,https://ncms.nculture.org/castle-road/story/2109,경상남도,진주시,경상남도 진주시 성지동 남강로 626,35.189839,128.079352,20181116,김중광,"논개의 얼이 서려 있는 조선 삼대 누각, 진주 촉석루|진주 촉석루, 임란 의병과 '논개'가 떠오르는 누정","남강, 토성, 김중광, 거영성, 김시민, 3대첩, 촉석성, 김태허, 남이홍, 창렬사, 영남포정사",20211230
2301,"인생 늘그막에 쉬어가는, 안동 만휴정",역사문화유산,누정,문화유산,건축유적,사대부의 누정,원림 명승의 누정,"명승으로 지정된 안동 만휴정은 영남 지역 대표적인 누정이다. 만휴정은 김계행이 70세의 나이에 낙향하여 지은 정자로, 이름 그대로 ‘인생 늘그막에 쉬어가는 정자’라는 의미가 그대로 느껴진다. 송암폭포 물줄기 위로 빼죽이 보이는 만휴정은 신선이 사는 장소처럼 보여진다. 만휴정을 노래한 시와  여러 편액들이 남아있다.",https://minio.nculture.org/amsweb-opt/multimedia_assets/240/15881/17249/c/15881-thumb.jpg,https://ncms.nculture.org/pavilion/story/2301,경상북도,안동시,경상북도 안동시 길안면 묵계리 1081,36.410379,128.9098316,20181116,김중망,,"누정, 정자, 원림, 안동, 만휴정, 명승, 김계행",20211230
2302,르 코르뷔지에의 제자 김중업이 설계한 - 부산대학교 구 본관,역사문화유산,근대문화유산,문화유산,건축유적,공간으로 읽는 근대문화 역사유산,근대의 산실 학교,"부산광역시 금정구 부산대학교 구 본관은 김중업이 설계한 작품이다. 금정산 자락의 경사지를 자연스럽게 이용해 1층을 필로티로 구성하고, 주 출입구 부분 좌우를 커튼월 통유리로 처리했으며, 중앙홀의 계단은 날아오르듯 설치한, 빼어난 건물로 평가된다. 더욱이 건물을 지은 시기가 1950년대 말 한국전쟁의 후유증에서 완전히 벗어나지 못한 때여서, 건물의 규모와 건축 방식은 부산대학교 학생과 관계자뿐만 아니라 부산시민들에게도 자랑거리가 되었다. 부산대학교는 해방",https://minio.nculture.org/amsweb-opt/3ds/5/84360/84360_thumbnail.jpg,https://ncms.nculture.org/legacy/story/1017,부산광역시,금정구,부산광역시 금정구 부산대학로 63번길 2,35.23669504,129.0821373,20181116,김중업,"건축예술과 공장의 만남, 안양 유유산업 옛 공장(현 김중업건축박물관)|건축가 김수근의 명과 암 - 서울 구 공간 사옥|르 코르뷔지에게 배운 한국 현대건축가 1세대 김중업","부산대학교, 부산대학교 구 본관, 부산대학교 인문대학, 윤안구, 김중업, 부산대학교 무지개문, 부산대학교 수위실, 부산대학교 넉넉한 터",20211230
2303,"건축예술과 공장의 만남, 안양 유유산업 옛 공장(현 김중업건축박물관)",역사문화유산,근대문화유산,문화유산,건축유적,공간으로 읽는 근대문화 역사유산,산업화의 꿈이 영근 곳들,"경기도 안양시 석수동 옛 유유산업 공장 부지는 신라 시대 고찰 중초사와 고려 시대 대가람 안양사가 있던 자리다. 유유산업 유특한 회장은 1950년대 말 석수동에 의약품 생산 공장을 짓기로 하고, 젊은 건축가 김중업에게 설계를 맡겼다. 프랑스 파리에서 르코르뷔지에로부터 건축과 도시를 배우고 1956년 돌아온 김중업은 유유산업의 건물 5개 동을 설계했다. 사무동, 생산동, 수위실, 굴뚝, 보일러실을 설계한 김중업은 ‘구축체계의 노출’과 ‘투명성’이라는 자신",https://minio.nculture.org/amsweb-opt/pdfs/16/27442/27442_thumbnail.jpg,https://ncms.nculture.org/legacy/story/2979,경기도,안양시,경기도 안양시 만안구 석수1동 예술공원로 103번길,37.418395,126.918231,20181116,김중업,르 코르뷔지에의 제자 김중업이 설계한 - 부산대학교 구 본관|건축가 김수근의 명과 암 - 서울 구 공간 사옥|르 코르뷔지에게 배운 한국 현대건축가 1세대 김중업,"유유산업, 김중업, 김중업건축박물관",20211230
2304,건축가 김수근의 명과 암 - 서울 구 공간 사옥,역사문화유산,근대문화유산,문화유산,건축유적,공간으로 읽는 근대문화 역사유산,근현대 인물들의 공간,서울특별시 종로구 율곡로의 구 ‘공간’ 사옥은 한국 현대건축계 1세대인 김수근이 1970년대에 설계했다. 구 사옥은 김수근의 집 자리에 처음에 지은 구관과 이어서 지은 신관을 일컫는다. ‘공간’ 건축사설계연구소이자 건축 문화예술 잡지 <공간>의 사무실로 지어진 구 사옥은 1990년대에 지어진 유리로 된 신 사옥과 2000년대에 재건축된 한옥으로 이루어져 있다. ‘공간’ 구 사옥은 한국의 전통 골목길을 재해석한 공간 배치로 유명하다. 스킵 플로어 방식으로,,https://ncms.nculture.org/legacy/story/4541,서울특별시,종로구,서울특별시 종로구 율곡로 83,37.57776184,126.9884166,20181116,김중업,"르 코르뷔지에의 제자 김중업이 설계한 - 부산대학교 구 본관|건축예술과 공장의 만남, 안양 유유산업 옛 공장(현 김중업건축박물관)|르 코르뷔지에게 배운 한국 현대건축가 1세대 김중업","김수근, 공간, 골목길",20211230
2305,르 코르뷔지에게 배운 한국 현대건축가 1세대 김중업,생활문화,지역문화예술인,종교와 문화,문화예술,건축,,김중업은 대한민국의 현대건축을 대표하는 1세대 건축가다. 1922년 평양에서 출생하여 평양고등보통학교를 마친 후 일본의 요코하마고등공업학교 건축학과에서 공부하였다. 이후 귀국하여 서울대학교를 비롯한 여러 대학에서 학생들을 가르치다가 베니스에서 열린 제1회 세계예술가회의에 한국 대표로 참석했다. 그 인연으로 파리의 르코르뷔지에(Le Corbusier) 건축 연구소에서 공부하게 되었다. 1956년 귀국하여 개인 건축설계사무실을 열고 건축 활동을 시작하였다.,,https://ncms.nculture.org/local-artist/story/5314,경기도,안양시,경기도 안양시 만안구 예술공원로103번길 4,37.41847369,126.9177262,20181116,김중업,"르 코르뷔지에의 제자 김중업이 설계한 - 부산대학교 구 본관|건축예술과 공장의 만남, 안양 유유산업 옛 공장(현 김중업건축박물관)|건축가 김수근의 명과 암 - 서울 구 공간 사옥","김중업, 1세대 건축가, 현대건축가",20211230
2306,육지에서 벌어진 대몽항전,역사문화유산,성과옛도로,자연과 지리,향토지,성과 성곽,성곽 속 역사 이야기,대륙을 평정한 몽고제국은 1231년(고종18) 8월 고려를 침략하였다. 아시아는 물론 유럽을 제패한 몽고제국과의 전쟁은 이로부터 40여 년간 이어진다. 고려는 몽골군과의 전투에서 주로 성곽을 의지하여 승리를 거두었다. 첫 승리는 귀주성 전투였는데 기습작전을 써서 적을 물리쳤다. 그 후 제1차 충주성 전투에서 승리하고 처인성 전투를 승리로 이끈 김윤후는 몽고의 대군이 충주성에 쳐들어왔을 때 70여 일 동안 몽골군을 맞이하여 뛰어난 지휘력을 발휘하여 적을,,https://ncms.nculture.org/castle-road/story/2222,,,,,,20181116,김중온,,"몽고제국, 귀주성 전투, 처인성 전투, 김윤후, 충주성 전투",20211230
2307,전형적인 안동지역의 사대부가옥인 안동 학암종택,생활문화,한국의 가옥,생활과 민속,생활,경상도의 가옥,반가(양반집),"경상북도 안동시 풍산읍 오미리에 위치한 조선 중종대의 청백리 허백당(虛白堂)의 12대손인 학암(鶴巖) 김중휴(金重休, 1797~1863)가 분가하면서 지은 건물이다. 김중휴가 제릉참봉을 지냈기에 ‘참봉댁’이라고도 부른다. 안동지역에 보편적인 형태인 ㅁ자형 몸채로 ㄱ자형 안채를 중심으로 정면 하단에 ?자형 사랑채와 일자형 중간채에 연접해 있다. 안채 우측에는 4칸 규모의 곳간채가 있어 이 집의 경제적 부유함을 느낄 수 있다. 조선후기로 오면 사랑채 공간이",https://minio.nculture.org/amsweb-opt/multimedia_assets/63/85758/93046/c/안동-학암종택-(1)_rev-thumb.jpg,https://ncms.nculture.org/house/story/6149,경상북도,안동시,경상북도 안동시 풍산읍 오미리 248,36.59755216,128.5222434,20181116,김중휴,,"양반집, 안동시, 학암, 김중휴, 학암종택, 참봉택, ㅁ자형구조",20211230
2308,의주와 대륙에서 한양으로 들어오는 관문 벽제관길,역사문화유산,성과옛도로,자연과 지리,향토지,옛 도로,사연을 품고 있는 옛길,"조선시대에 한양에서 평안도를 지나 중국으로 이어지던 길은 의주대로이다. 중국에서 한양으로 오는 사신이나 한양에서 중국으로 가는 연행단도 의주대로를 이용해 왕래했다. 중국에서 온 사신이 한양으로 들어오기 전 경기도 고양의 벽제관에서 하룻밤을 묵은 뒤 한양으로 진입했으며, 한양에서 출발한 사신들도 벽제관에서 하룻밤을 묵고 중국으로 향했다. 벽제관으로 오가던 벽제관길은 한양으로 드나드는 첫 번째 관문이었다.",https://minio.nculture.org/amsweb-opt/multimedia_assets/130/12595/19028/c/12595-thumb.jpg,https://ncms.nculture.org/castle-road/story/2160,경기도,고양시,경기도 고양시 덕양구,37.653951,126.896575,20181116,김지남,,"의주길, 의주대로, 사신, 관문, 벽제관, 혜음령, 숫돌고개, 모화관",20211230
2309,"진주 촉석루, 임란 의병과 '논개'가 떠오르는 누정",역사문화유산,누정,문화유산,건축유적,"궁궐, 관아의 누정",관아의 누정,"우리나라의 3대 누각 중 하나인 진주 촉석루(矗石樓)하면 먼저 연상되는 인물이 있다. 바로 ‘논개’다. 진주성은 임진왜란 3대 전투에 속하는 진주대첩의 장소로, 당시 치열한 전투가 벌어졌지만 결국 진주성은 함락되었고, 승전을 자축하는 연회에서 ‘논개’가 적장을 끌어안고 남강으로 몸을 던졌다. 그래서 진주하면 ‘임진왜란-촉석루-논개’가 꼬리표처럼 따라다닌다. 촉석루를 노래했던 문인들의 감흥도 임진왜란이 발발한 전후로 크게 달라졌음을 알 수 있다.",https://minio.nculture.org/amsweb-opt/multimedia_assets/18/16008/16710/c/16008-thumb.jpg,https://ncms.nculture.org/pavilion/story/2273,경상남도,진주시,경상남도 진주시 본성동 500-1,35.189441,128.08181,20181116,김지대,,"촉석루, 진주 촉석루, 논개, 누정, 누각, 진주성",20211230
2310,"분단의 남과 북을 가로지른 영화 왕국의 여왕, 최은희",생활문화,지역문화예술인,종교와 문화,문화예술,연극/영화,,"초창기 한국 영화를 대표하는 ‘스타’ 여배우였던 최은희는 1943년 「청춘극장」으로 연기의 길에 들어선 4년 후 스크린에 데뷔해 2백여 편에 출연했다. 1960년대 한국영화의 전성기에는 김지미, 엄앵란과 함께 여배우 트로이카로 이름을 날렸고, 한국적인 ‘모성 표상’의 주인공으로 이미지가 각인된 탓에, 한국 영화사에서 박남옥과 홍은원을 잇는 세 번째 여성감독이라는 정체성은 희석되었다. 신필름의 대표였던 남편 신상옥과 활동하다 북한에 납치되어 영화 제작을",https://minio.nculture.org/amsweb-opt/multimedia_assets/219/29936/15697/c/감독-최은희_영화진흥위원회-thumb.jpg,https://ncms.nculture.org/local-artist/story/811,경기도,광주시,경기도 광주시 행정타운로 50,37.42928622,127.2550706,20181116,김지미,"눈물로 바라보며 전장에 나서다, 영화 『한 많은 대동강(1966)』","사랑방 손님과 어머니, 안양영화예술학교, 여성감독, 근현대 여성예술인, 최은희",20211230
2311,"눈물로 바라보며 전장에 나서다, 영화 『한 많은 대동강(1966)』",국난극복,6·25전쟁,지방의 역사,현대,6·25전쟁 관련 문화예술,6·25전쟁 관련 영화,"1966년 합동영화사에서 제작된 「한 많은 대동강」은 유일수·유한철 각본, 최인현 감독의 전쟁영화이다. 김지미, 남궁원, 최무룡, 박노식 등의 배우가 출연했다. 6·25 전쟁으로 평양탈환작전에 참전한 주인공은 사랑하는 여인을 찾았지만, 다시 그녀와 이별의 슬픔을 간직하고 전장으로 향하는 이야기로 분단의 비극을 그린 영화이다.",,https://ncms.nculture.org/korean-war/story/4364,,,,,,20181116,김지미,"분단의 남과 북을 가로지른 영화 왕국의 여왕, 최은희","대동강, 평양턀환작전, 추억의 한국영화, 전쟁영화, 최인현, 이미자, 한많은 대동강",20211230
2312,다섯 형제가 과거에 급제한 경상북도 안동시의 오미리,생활문화,지명유래,"구비전승,어문학",지명유래,경상북도 지역의 지명유래,,"경상북도 안동시 풍산읍에 ‘오미리(五美里)’라는 마을이 소재해 있다. 오미리는 500여 년이 넘도록 풍산김씨(豊山金氏)들이 살아온 집성촌이다. 옛날 오미마을 풍천김씨 문중에 아들만 아홉을 둔 한 집이 있었다. 아홉 명의 아들들은 모두 총명해서 마을 사람들로부터 칭찬이 끊이지 않았다. 특히 아홉 명의 아들 가운데 막내아들이 영리해, 자식이 없었던 안동부사의 양자로 들어가게 되었다. 그런데 양자로 들어간 막내아들이 그만 물놀이를 하다가 물에 빠져 죽고 말았",https://minio.nculture.org/amsweb-opt/multimedia_assets/25/73223/71240/c/오미동-풍산김씨-영감댁-(1)-thumb.jpg,https://ncms.nculture.org/origin-of-place-names/story/6807,경상북도,안동시,경상북도 안동시 풍산읍 미동길 56,36.59709752,128.5215712,20181116,김지섭,,"풍산김씨, 설화, 안동 오미리, 집성촌, 광생절, 풍수지리",20211230
2313,"향운설화의 대표적인 정자, 정읍 군자정",역사문화유산,누정,문화유산,건축유적,사대부의 누정,마을과 들녘의 누정,"군자정은 전라북도 정읍시 고부면 영주로 532-7(고부리)에 있는 조선시대의 정자이다. 전라북도유형문화재 제133호이다. 사방이 연못으로 둘러 싸인 정자여서 연정(蓮亭)이라고도 한다. 최초의 창건 연대는 정확히 알 수 없으나 역사가 오래된 정자이다. 군자정은 고장의 운명과 관련된 향운설화(鄕運說話)의 대표적인 정자로, 고을의 운명을 길하게 하기 위해 연정을 파고 정자를 개보수한 설화와 역사를 함께한 정자이다. 군자정이란 정자명은 주돈이의 「애련설」에서",https://minio.nculture.org/amsweb-opt/pdfs/14/27440/27440_thumbnail.JPG,https://ncms.nculture.org/pavilion/story/2329,전라북도,정읍시,전라북도 정읍시 고부면 영주로 532-7,35.618988,126.772415,20181116,김지수,,"누정, 정자, 누각, 향운설화, 주돈이, 애련설, 연정, 김지수, 고부, 이후선, 이세형, 조규희, 이창익, 은성우, 사정(射亭), 김상원, 노희원, 은상선, 은이철, 홍익모, 은희형",20211230
2314,"민중의 칼춤을 목판에 새기다, 판화가 오윤(吳潤)",생활문화,지역문화예술인,성씨와 인물,인물,미술,,"한국의 판화가다. 민족적인 정서를 바탕으로 전통미술을 창조적으로 재해석한 목판화를 주로 남겼다. 다수의 사람들과 소통하기 위하여 복제가 가능한 판화를 매체로 선택하였고, 강렬하고 표현적인 칼 선으로 민중의 혁명성을 부각시켰다. 대표 작품으로는 「대지」, 「노동의 새벽」, 「애비」, 「칼 노래」, 「북춤」, 「낮도깨비」, 「통일 대원도」 등이 있다.",,https://ncms.nculture.org/local-artist/story/4593,부산광역시,동래구,부산 동래구 명륜2동 137,35.21198537,129.0900925,20181116,김지하,참여시와 저항시를 쓴 시인 조태일,"오윤, 판화가, 조각가, 목판화, 노동의 새벽, 칼노래, 통일대원도",20211230
2315,참여시와 저항시를 쓴 시인 조태일,생활문화,지역문화예술인,종교와 문화,문화예술,문학,,"전남 곡성 태생의 시인 조태일은 1964년에 등단한 후 1970년대에 독재에 저항하다 여러 번 투옥되었고, 1980년부터 3년간 수감생활을 했던 저항시인이자 참여시인이다. 초기에는 순수시를 썼으나 점차 폭력에 맞서는 참여시를 썼다. 시집 『아침 선박』, 『식칼론』, 『자유가 시인더러』, 『풀잎은 꺾이지 않는다』 등이 있다. 『시인』을 창간하여 김지하, 양성우 등을 발굴하기도 했다. 전남 곡성 태안사 근처에 조태일시문학관이 있다.",https://minio.nculture.org/amsweb-opt/3ds/108/84463/84463_thumbnail.jpg,https://ncms.nculture.org/local-artist/story/1100,전라남도,곡성군,전남 곡성군 죽곡면 태안로 622-38,35.13351624,127.368594,20181116,김지하,"민중의 칼춤을 목판에 새기다, 판화가 오윤(吳潤)","시인, 광주대학교, 식칼론, 곡성, 아침선박, 조태일시문학관",20211230
2316,임권택 감독의 전쟁영화 『낙동강은 흐르는가(1976)』,국난극복,6·25전쟁,지방의 역사,현대,6·25전쟁 관련 문화예술,6·25전쟁 관련 영화,"「낙동강은 흐르는가」는 1976년 우진필름에서 제작된 6·25전쟁을 배경으로 한 임권택 감독의 전쟁영화이다. 나한봉과 한성의 각본으로 진유영, 유영국, 김지혜, 장혁 등이 출연하였으며, 상영시간은 95분이다. 6·25전쟁 당시 낙동강 방어선에서 북한군과 대적하는 국군의 고군분투와 희생정신을 그렸다.",https://minio.nculture.org/amsweb-opt/multimedia_assets/143/21513/9419/c/21513-thumb.jpg,https://ncms.nculture.org/korean-war/story/4307,,,,,,20181116,김지혜,,"6·25전쟁, 한국전쟁, 낙동강, 육탄 10용사, 임권택, T-34, M47, 전차 5대",20211230
