DATA_MANAGE_NO,DATA_TITLE_NM,THEME_NM,LWPRT_THEME_NM,CL_NM,LWPRT_CL_NM,SBJT_NM,MIDDL_SBJT_NM,SUMRY_CN,MAIN_THUMB_URL,CNTNTS_URL,CTPRVN_NM,SIGNGU_NM,ADDR,CTLSTT_LA,CTLSTT_LO,REGIST_DE,RELATE_PRSN_NM,RELATE_STRY_NM,CORE_KWRD_CN,OPN_DE
2687,600년의 역사를 간직한 대추나무 아래에서 열리는 ‘무릉골 낭만의 밤’,생활문화,우리마을이야기,자연과 지리,마을경관,전라북도 마을 산책,,"1999년에 시작된 ‘무릉골 낭만의 밤’은 서울에서 살던 시인 부부(박희종, 남궁선순)가 전라북도 진안군 주천면 무릉리 산골에 귀농하여 만든 모임에서 출발하였다. 1999년부터 해마다 한 번씩 서로 뜻이 맞는 사람들이 모여 어울리면 즐기던 행사 점점 커져 ‘무릉골 낭만의 밤’이란 축제로 이어져 온 지 20년이 넘었다.",https://minio.nculture.org/amsweb-opt/multimedia_assets/64/72739/68329/c/%EB%B0%95%ED%9D%AC%EC%A2%85%EB%8C%81-%EC%A3%BC%EB%B3%80%EB%AA%A8%EC%8A%B5-thumb.jpg,https://ncms.nculture.org/story-of-our-hometown/story/6791,전라북도,진안군,전라북도 진안군 주천면 강촌길 28-10,36.01060356,127.3821165,20181116,남궁선순,,"무릉골 낭만의 밤, 축제, 진안 무릉골",20211230
2688,"비극적인 전쟁멜로영화, 『남과 북(1965)』",국난극복,6·25전쟁,지방의 역사,현대,6·25전쟁 관련 문화예술,6·25전쟁 관련 영화,"「남과 북」은 1965년 한운사 원작·각본으로 대성흥업이 제작한 김기덕 감독의 작품이다. 내용은 실화를 바탕으로 한 것으로 8·15 직후 남하한 애인을 찾아 귀순한 북한군 부대 대대장에 얽힌 이야기로 남과 북의 두 남성과 그 사이에서 갈등하는 한 여자의 비극적인 관계를 그린 전쟁 멜로드라마이다. 엄앵란, 신영균, 최무룡, 남궁원 등이 출연, 음악은 박춘석이 작곡하였다. 상영시간은 114분이다.",https://minio.nculture.org/amsweb-opt/multimedia_assets/138/21494/9399/c/21494-thumb.jpg,https://ncms.nculture.org/korean-war/story/4119,,,,,,20181116,남궁원,"민족상잔의 참상, 영화 『5인의 사형수(1969)』|정진우 감독의 반공영화 『8240K.L.O(1966)』|이산가족의 아픔이 담긴 영화 『내가 마지막 본 흥남(1983)』|눈물로 바라보며 전장에 나서다, 영화 『한 많은 대동강(1966)』|흥행과 예술성을 고루 갖춘 영화 『원산공작(1976)』|전쟁의 숭고한 희생과 헌신, 영화 『아벤고 공수공단(1982)』","추억의 한국영화, 전쟁영화, 김기덕",20211230
2689,"민족상잔의 참상, 영화 『5인의 사형수(1969)』",국난극복,6·25전쟁,지방의 역사,현대,6·25전쟁 관련 문화예술,6·25전쟁 관련 영화,"「5인의 사형수」는 1969년 세기상사가 제작한 강민호 감독의 전쟁영화이다. 장동휘, 남궁원, 허장강, 황해, 박암 등이 출연했고 상영시간은 105분이다. 영화 ‘해병특공대’(1965)로 감독 데뷔한 강민호의 다섯 번째 연출작으로 이후&nbsp; 호국극영화와 육군영화 등 특수 장르의 영화제작에 참여해왔다.",,https://ncms.nculture.org/korean-war/story/4188,,,,,,20181116,남궁원,"비극적인 전쟁멜로영화, 『남과 북(1965)』|정진우 감독의 반공영화 『8240K.L.O(1966)』|이산가족의 아픔이 담긴 영화 『내가 마지막 본 흥남(1983)』|눈물로 바라보며 전장에 나서다, 영화 『한 많은 대동강(1966)』|흥행과 예술성을 고루 갖춘 영화 『원산공작(1976)』|전쟁의 숭고한 희생과 헌신, 영화 『아벤고 공수공단(1982)』","추억의 한국영화, 전쟁영화, 고전영화, 사형수, 강민호, 윤정희",20211230
2690,정진우 감독의 반공영화 『8240K.L.O(1966)』,국난극복,6·25전쟁,지방의 역사,현대,6·25전쟁 관련 문화예술,6·25전쟁 관련 영화,"1966년 제작된 「8240K.L.O」는 6·25전쟁 중 후방교란 및 첩보수집 등의 특수 임무를 수행한 KLO부대를 소재로 하여, 북한군이 건설한 화약공장을 파괴하기 위해 북에 침투하여 작전을 완수하는 남한대원들의 활약상을 그린 정진우 감독의 반공영화이자 전쟁영화이다. 제5회 대종상 영화제에서 우수반공영화상을 수상한다.",,https://ncms.nculture.org/korean-war/story/4227,,,,,,20181116,남궁원,"비극적인 전쟁멜로영화, 『남과 북(1965)』|민족상잔의 참상, 영화 『5인의 사형수(1969)』|이산가족의 아픔이 담긴 영화 『내가 마지막 본 흥남(1983)』|눈물로 바라보며 전장에 나서다, 영화 『한 많은 대동강(1966)』|흥행과 예술성을 고루 갖춘 영화 『원산공작(1976)』|전쟁의 숭고한 희생과 헌신, 영화 『아벤고 공수공단(1982)』","추억의 한국영화, 전쟁영화, K.L.O, 켈로부대, 화약공장",20211230
2691,이산가족의 아픔이 담긴 영화 『내가 마지막 본 흥남(1983)』,국난극복,6·25전쟁,지방의 역사,현대,6·25전쟁 관련 문화예술,6·25전쟁 관련 영화,"「내가 마지막 본 흥남」은 북한군 병사가 아군 측에 구출되어 분단으로 이산가족이 되어버린 남한의 친아버지를 찾는 과정과 그에 따른 갈등을 그리고 있는 반공드라마영화이다. 1983년 조문진의 각본을 고영남 감독이 연출하고 우진필름에서 제작했다. 남궁원, 이구선, 김형자, 조용원, 김진해, 김형자, 백일섭 등이 출연하였고, 상영시간은 104분이다. 한편 이 영화가 개봉된 1983년은 휴전 30주년으로 6.25 특집주간 “KBS이산가족찾기”가 방송되어 전쟁과",,https://ncms.nculture.org/korean-war/story/4237,,,,,,20181116,남궁원,"비극적인 전쟁멜로영화, 『남과 북(1965)』|민족상잔의 참상, 영화 『5인의 사형수(1969)』|정진우 감독의 반공영화 『8240K.L.O(1966)』|눈물로 바라보며 전장에 나서다, 영화 『한 많은 대동강(1966)』|흥행과 예술성을 고루 갖춘 영화 『원산공작(1976)』|전쟁의 숭고한 희생과 헌신, 영화 『아벤고 공수공단(1982)』","전쟁영화, 6·25, 이산가족, 북한군, 국군, 월남",20211230
2692,"눈물로 바라보며 전장에 나서다, 영화 『한 많은 대동강(1966)』",국난극복,6·25전쟁,지방의 역사,현대,6·25전쟁 관련 문화예술,6·25전쟁 관련 영화,"1966년 합동영화사에서 제작된 「한 많은 대동강」은 유일수·유한철 각본, 최인현 감독의 전쟁영화이다. 김지미, 남궁원, 최무룡, 박노식 등의 배우가 출연했다. 6·25 전쟁으로 평양탈환작전에 참전한 주인공은 사랑하는 여인을 찾았지만, 다시 그녀와 이별의 슬픔을 간직하고 전장으로 향하는 이야기로 분단의 비극을 그린 영화이다.",,https://ncms.nculture.org/korean-war/story/4364,,,,,,20181116,남궁원,"비극적인 전쟁멜로영화, 『남과 북(1965)』|민족상잔의 참상, 영화 『5인의 사형수(1969)』|정진우 감독의 반공영화 『8240K.L.O(1966)』|이산가족의 아픔이 담긴 영화 『내가 마지막 본 흥남(1983)』|흥행과 예술성을 고루 갖춘 영화 『원산공작(1976)』|전쟁의 숭고한 희생과 헌신, 영화 『아벤고 공수공단(1982)』","대동강, 평양턀환작전, 추억의 한국영화, 전쟁영화, 최인현, 이미자, 한많은 대동강",20211230
2693,흥행과 예술성을 고루 갖춘 영화 『원산공작(1976)』,국난극복,6·25전쟁,지방의 역사,현대,6·25전쟁 관련 문화예술,6·25전쟁 관련 영화,"「원산공작」은 1976년 세경흥업에서 제작한 6·25전쟁을 배경으로 한 설태호 감독의 전쟁영화이다. 서윤성 원작으로 남궁원, 태현실, 프레드릭 필스가 출연한 1970년대 반공영화로 상여시간 115분이다. 이 영화는 흥행과 예술성을 두루 갖춘 작품이지만 반공영화의 한계를 벗어나지는 못하였다.",,https://ncms.nculture.org/korean-war/story/4373,,,,,,20181116,남궁원,"비극적인 전쟁멜로영화, 『남과 북(1965)』|민족상잔의 참상, 영화 『5인의 사형수(1969)』|정진우 감독의 반공영화 『8240K.L.O(1966)』|이산가족의 아픔이 담긴 영화 『내가 마지막 본 흥남(1983)』|눈물로 바라보며 전장에 나서다, 영화 『한 많은 대동강(1966)』|전쟁의 숭고한 희생과 헌신, 영화 『아벤고 공수공단(1982)』","원산, 전쟁영화, 6·25, 페스트, 설태호, 유엔군, 한국군, 반공유격대원, 비밀특공대",20211230
2694,"전쟁의 숭고한 희생과 헌신, 영화 『아벤고 공수공단(1982)』",국난극복,6·25전쟁,지방의 역사,현대,6·25전쟁 관련 문화예술,6·25전쟁 관련 영화,"「아벤고 공수공단」은 6·25전쟁 당시 인천상륙작전을 은폐하기 위한 양동작전으로 원산에 투입된 아벤고 공수부대원들의 활약상을 그린 전쟁영화이다. 1982년 우진필름에서 제작한 이 영화는  김강윤 각본으로 임권택 감독이 연출한 군사영화이다. 신일룡, 정윤희, 남궁원,&nbsp; 윤양하, 김희라 등이 출연했고, 상영시간 136분이다.",,https://ncms.nculture.org/korean-war/story/4374,,,,,,20181116,남궁원,"비극적인 전쟁멜로영화, 『남과 북(1965)』|민족상잔의 참상, 영화 『5인의 사형수(1969)』|정진우 감독의 반공영화 『8240K.L.O(1966)』|이산가족의 아픔이 담긴 영화 『내가 마지막 본 흥남(1983)』|눈물로 바라보며 전장에 나서다, 영화 『한 많은 대동강(1966)』|흥행과 예술성을 고루 갖춘 영화 『원산공작(1976)』","전쟁영화, 아벤고, 남궁원, 임권택, 군사영화, 인천상륙작전, 양동작전, 6.25전쟁",20211230
2695,더 좋은 탄광 문학을 생산하기 위하여: 탄광문학세미나,산업,탄광,경제와 산업,광공업,탄광 문화 예술과 축제,탄광의 문화예술,"탄광문학세미나는 탄광문학 연구를 활성화시키는 역할을 했다. 『한국탄광시전집』간행을 전후하여 탄광문학세미나가 개최되면서 학계의 관심이 높아지면서 논문과 평론이 양산되었다. 또 삼척시의 탄광문학축제, 태백시의 탄광학술세미나 등 탄광문학을 테마로 하는 행사들이 개최됐다. 탄광문학 연구는 탄광촌이 지닌 정체성을 이해하는 성과를 거두었다.",,https://ncms.nculture.org/coalmine/story/3771,강원특별자치도,태백시,강원 태백시 태백로 1136,37.1567381,128.9894769,20181116,남기택,,"탄광문학세미나, 한국탄광시전집, 탄광문학축제, 탄광학술세미나, 맹문재, 남기택",20211230
2696,탄광촌 배경 드라마,산업,탄광,경제와 산업,광공업,탄광 문화 예술과 축제,탄광의 문화예술,"&lt;약속의 땅&gt;은  태백의 탄광을 배경으로 촬영한 일일드라마로 KBS1 방송국에서 1982년 1월 4일~9월18일까지 월요일~금요일에 방영하였고, &lt;젊은이의 양지&gt;는 1995년대에 사북의 탄광촌과 서울 대도시를 배경으로 출세를 열망하는 젊은이들의 야망과 배신을 주제로 한 드라마이다. 이 드라마는 KBS2 방송국에서 1995년 5월 6일~11월 12일까지 매주 토·일요일에 방영하였다. &lt;에덴의 동쪽&gt;은 MBC의 56부작 월·",,https://ncms.nculture.org/coalmine/story/3780,강원특별자치도,태백시,강원도 태백시 사북읍,37.227701,128.821773,20181116,남능미,,"탄광, 드라마, 태백, 사북, 복수",20211230
2697,"김홍도의 그림에 보이는, 통천 환선정",역사문화유산,누정,문화유산,건축유적,그림 속의 누정,,"환선정(喚仙亭)은 강원도 통천군 고저읍 총석리 바닷가에 있었던 조선시대의 누정이다. 총석정(叢石亭) 맞은편에 있는 정자이다. 현재 북한 지역에 속해 있다. 환선정 주변의 현무암 용암이 오랜 세월 비바람과 파도에 부딪혀 6각형 혹은 8각형 등의 여러 가지 모양의 돌기둥을 이룬 주상절리가 신기하고 아름다워 금강산 유람에 빠지지 않는 명소이었으며, 이곳을 ‘통천금강(通川金剛)’이라고도 불렀다. 주변의 절경이 신선을 불러들인다고 하여 환선정이라 정자명을 붙였다",,https://ncms.nculture.org/pavilion/story/2334,,,,,,20181116,남랑,"관동팔경 중 으뜸인, 통천 총석정","누정, 정자, 누각, 총석정, 통천금강, 이유원, 임하필기, 박권, 북정일기, 이하곤, 동유록, 정선, 신묘년풍악도첩, 환선정도, 김홍도, 금강사군첩, 해악도병, 이풍익, 동유첩",20211230
2698,"관동팔경 중 으뜸인, 통천 총석정",역사문화유산,누정,문화유산,건축유적,그림 속의 누정,,총석정(叢石亭)은 강원도 통천군 고저읍 총석리 바닷가에 있는 누정이다. 관동팔경(關東八景) 중 한 곳으로 그 가운데 가장 유명하였다. 현재 북한 지역에 속해 있다. 총석정이라는 정자 명은 바다 위에 빽빽이 솟아 있는 돌기둥[叢石] 위에 세워진 정자라는 뜻이다. 지리적으로 현무암 용암이 오랜 세월 비바람과 파도에 부딪혀 6각형 혹은 8각형 등의 여러 가지 모양의 돌기둥을 이룬 주상절리 위에 세워진 정자이다. 신라의 술랑(述郞)·남랑(南郞)·영랑(永郞)·안,https://minio.nculture.org/amsweb-opt/multimedia_assets/132/19473/16131/c/19473-thumb.jpg,https://ncms.nculture.org/pavilion/story/2368,강원특별자치도,,,,,20181116,남랑,"김홍도의 그림에 보이는, 통천 환선정","누정, 정자, 누각, 관동팔경, 통천, 사선봉, 관동십경, 통천금강, 김극기, 안축, 정철, 관동별곡, 성현, 이달, 김창업, 정선, 김창흡, 이병연, 이병성, 이속, 총석정도, 신묘년풍악도첩, 해악전신첩, 관동명승첩, 해악전신사생첩, 백납병풍, 김홍도, 금강사군첩, 을묘년화첩, 해악도병, 관동팔경도, 허필, 관동팔경도병, 이인문, 정수영, 이재관, 김하종, 김규진, 총석정절경도",20211230
2699,나라를 찾으러 춘생문의거를 일으킨 이도철,국난극복,의병,지방의 역사,개항기(1876~1910),한말 의병,한말 의병장,"이도철(李道徹, 1852~1895)은 한말의 선비로 1895년 10월 12일 민비시해에 대한 복수와 고종임금의 안위를 위한 창의정신으로 궁궐을 넘다가 잡혀 사형 당하였다. 고종은 이도철에게 충민(忠愍)이란 시호를 내렸고, 장충단을 건립하여 1900년부터 1908년까지 불천위로 제향을 했다.",,https://ncms.nculture.org/righteous-army/story/4034,충청북도,제천시,충북 제천시 의림대로 125(시민회관 3층),37.139222,128.2107866,20181116,남만리,,"이도철, 춘생문사건, 장충단, 충민",20211230
2700,경남 합천의 의병장 이대기,국난극복,의병,지방의 역사,조선,임진왜란 의병,임진왜란 의병장,"이대기(李大期, 1551∼1628)는 경상남도 합천군 초계에서 태어났다. 남명 조식의 문하에서 수학하였다. 42세 되던 해 합천 초계에서 전치원과 의병을 일으켜 싸웠다.",,https://ncms.nculture.org/righteous-army/story/4056,경상남도,합천군,경상남도 합천군 청덕면 대부리,35.54121,128.33821,20181116,남명,,"이대기, 임진왜란",20211230
2701,차나 한잔 마시고 가시게 ? 남해 덕신리 하천다숙,역사문화유산,근대문화유산,문화유산,건축유적,공간으로 읽는 근대문화 역사유산,근대의 산실 학교,경상남도 남해군 설천면 덕신리 하천다숙은 원래 밀양 박 씨 규정공파 문중 가묘로 건축된 집이다. 하천재는 1938년 박병집과 그의 아들 만암 박채규가 선친을 기리기 위해 세웠다. 1960년대 후반까지 집안 모임과 제사용으로 쓰이던 하천재를 박병집의 손자 아인 박종한이 한국 차 문화의 산실로 바꾸었다. 박종한은 일제강점기 말 반진단원으로서 부산항 폭파 거사를 도모하다가 발각되어 옥고를 치렀다. 해방 후 반진단은 교육이 새 조국에 절실한 사업이라고 뜻을 모,,https://ncms.nculture.org/legacy/story/771,경상남도,남해군,경상남도 남해군 설천면 창남로72번길 70-19,34.92421588,127.875847,20181116,남명 조식,,"하천재, 하천다숙, 박종한, 대아고등학교, 경모헌, 세심헌, 옥산문, 끽다거",20211230
2702,이효영 대령의 실화를 다룬 영화 『성난독수리(1965)』,국난극복,6·25전쟁,지방의 역사,현대,6·25전쟁 관련 문화예술,6·25전쟁 관련 영화,"「성난 독수리」는 6·25전쟁에 참전한 이효영 대령의 실화를 바탕으로 만든 영화로 1965년 공개된 김기 감독의 작품이다. 이효영 원작, 이이령·윤석주 각본으로 한국예술영화사에서 제작하였고, 신영균, 태현실, 황해, 이예춘, 최지희, 남미리, 석일우, 김무남 등이 출연했다.",,https://ncms.nculture.org/korean-war/story/4109,,,,,,20181116,남미리,민족분단의 비극을 담은 영화 『들국화는 피었는데(1974)』,"추억의 한국영화, 전쟁영화, 공군",20211230
2703,민족분단의 비극을 담은 영화 『들국화는 피었는데(1974)』,국난극복,6·25전쟁,지방의 역사,현대,6·25전쟁 관련 문화예술,6·25전쟁 관련 영화,"1974년 개봉한 「들국화는 피었는데」는 6·25전쟁을 배경으로 이만희 감독이 연출한 전쟁영화이다. 신성일, 우연정, 오유경, 김정훈 등이 출연했고 상영시간은 102분이다. 국군은 물론 인민군과도 친하게 지내던 열 살의 주인공 돌이에게도 전쟁의 비극이 찾아온다.",https://minio.nculture.org/amsweb-opt/multimedia_assets/142/21506/9412/c/21506-thumb.jpg,https://ncms.nculture.org/korean-war/story/4220,,,,,,20181116,남미리,이효영 대령의 실화를 다룬 영화 『성난독수리(1965)』,"인민군, 국군, 소년, 포로, 전쟁영화, 국책영화, 6·25전쟁",20211230
2704,"조선 중기의 명 역술인 남사고를 제향한, 영동 화수루",역사문화유산,누정,문화유산,건축유적,사대부의 누정,가옥의 누정,"화수루는 충청북도 영동군 상촌면 하도대3안길 33-18(하도대리)에 있는 조선시대의 정자이다. 충청북도유형문화재 제165호이다. 원래는 1546년(명종 1)에 옥계에 있는 옥계서당을 지었을 때 그 옆에 작은 누각으로 지어졌다. 1613년(광해군 5)에 중수되었으며, 1804년(순조 4)에 지금의 위치인 하도대리로 옮겨 짓고 이름도 화수루로 바꾸었다고 한다. 옥계서당은 조선 중기의 학자이자 역술인인 남사고(1509~1571)가 제향되었던 곳이다. 남사고는",https://minio.nculture.org/amsweb-opt/multimedia_assets/7/17425/17634/c/17425-thumb.jpg,https://ncms.nculture.org/pavilion/story/2325,충청북도,영동군,충청북도 영동군 상촌면 하도대3안길 33-18,36.1347,127.895396,20181116,남민지,,"누정, 정자, 누각, 옥계서당, 남사고, 고성남씨, 신흠, 상촌잡록, 권극례, 김윤신, 남사고비결, 격암유록, 남격암십승지론, 정감록, 선택기요, 황여일, 이재, 김하구, 화수루",20211230
2705,세계탈놀이경연대회에 출연한 울산 병영서낭치기,생활문화,지역놀이,생활과 민속,민속,울산의 민속놀이,,"울산 병영서낭치기는 조선 후기부터 울산 지역에 전해오는 정초의 축귀의식이면서 놀이 형태이다. 병영과 4개 마을 중심의 서낭대 의식, 오방위 축귀의식, 매구패(풍물) 중심의 지신밟기 등이 어우러졌으며, 20세기 초에 중단되었다가 10여년 전에 부분 복원하여 전승하고 있다.",,https://ncms.nculture.org/folkplay/story/609,울산광역시,중구,울산광역시 중구 복산2동 단장골길 1,35.5693656,129.3326008,20181116,남방적제장군,,"병영, 서낭치기, 울산시, 정초, 농악, 서낭대, 매귀악, 지신밝기, 오방색, 오방신장, 학성지, 할미, 영감",20211230
2706,"음악으로 소통하는 무대 한마당, 거제영등오광대놀이",생활문화,지역놀이,생활과 민속,민속,경상남도 민속놀이,,거제영등오광대는 거제시 둔덕면 학산(옛 명칭 영등) 지역에서 전승되는 전체 5마당으로 이루어진 오광대놀이의 한 종류이다. 1990년대 초에 복원하여 현재 거제영등오광대보존회 중심으로 전승하고 있다.,,https://ncms.nculture.org/folkplay/story/599,경상남도,거제시,경상남도 거제시 둔덕면 하둔리 365-64,34.83683972,128.5051399,20181116,남방홍제장군,,"거제시, 영등오광대, 정월대보름, 학산리, 오방신장무, 문둥이, 포수, 담비, 사자, 말뚝이, 양반, 영등할미, 영감",20211230
2707,분단의 현실을 한탄한 노래 『휴전선 나그네』,국난극복,6·25전쟁,지방의 역사,현대,6·25전쟁 관련 문화예술,6·25전쟁 관련 노래,"전쟁이 끝나고 10년이 지나도록 고향에 돌아가지 못하는 그리움을 표현한 노래로 1962년에 만들어졌다. 물새와 뱃사공을 등장시켜 자연적으로는 이어져 있는 길인데, 철조망과 국경선으로 막혀 가지 못함을 한탄하는 노래 가사로 이루어져 있다.&nbsp;",,https://ncms.nculture.org/korean-war/story/4313,,,,,,20181116,남백송,,"휴전선, 철조망, 임진강, 송악산, 평양, 남백송",20211230
2708,조선 창극의 ‘프리마돈나’ 박녹주,생활문화,지역문화예술인,종교와 문화,문화예술,음악,,"경상북도 선산(현, 구미시) 출신 명창 박녹주(朴綠珠)는 일제강점기 조선성악연구회가 주도한 창극 공연에서 활약하며 큰 인기를 누린 조선 창극의 ‘프리마돈나’였다. 동편제 판소리의 명맥을 이어받아 후진을 양성하여, 현전하는 <흥보가> 전승에 영향을 끼친 박록주는 ‘여성국악동호회’를 창립한 선구적 여성국악인로서 국악 보존을 위해 일생 동안 노력한 인물이기도 하다.",,https://ncms.nculture.org/local-artist/story/4626,경상북도,구미시,경상북도 구미시 선산읍 동부리 542-3,36.24345555,128.2999137,20181116,남백우,,"창극, 조선성악연구회, 여성국악동호회",20211230
2709,민족적 수난의 현실을 노래한 『두만강아 전해다오』,국난극복,6·25전쟁,지방의 역사,현대,6·25전쟁 관련 문화예술,6·25전쟁 관련 노래,"‘두만강아 전해다오’는 전쟁이 끝나고도 고향으로 돌아가지 못하는 피난민의 심정을 노래한 곡으로, 임을 찾아 헤매는 애상성과 개인적인 감상에, 민족적 수난이라는 대승적 차원이 겹쳐진다. 남이장군의 시를 일부 차용하여, 두만강을 남자의 기개를 드러내는 상징적인 단어로 사용하였다.&nbsp;",,https://ncms.nculture.org/korean-war/story/4359,,,,,,20181116,남빈,,"두만강, 백두산, 남이 장군",20211230
2710,"조선 중기의 명 역술인 남사고를 제향한, 영동 화수루",역사문화유산,누정,문화유산,건축유적,사대부의 누정,가옥의 누정,"화수루는 충청북도 영동군 상촌면 하도대3안길 33-18(하도대리)에 있는 조선시대의 정자이다. 충청북도유형문화재 제165호이다. 원래는 1546년(명종 1)에 옥계에 있는 옥계서당을 지었을 때 그 옆에 작은 누각으로 지어졌다. 1613년(광해군 5)에 중수되었으며, 1804년(순조 4)에 지금의 위치인 하도대리로 옮겨 짓고 이름도 화수루로 바꾸었다고 한다. 옥계서당은 조선 중기의 학자이자 역술인인 남사고(1509~1571)가 제향되었던 곳이다. 남사고는",https://minio.nculture.org/amsweb-opt/multimedia_assets/7/17425/17634/c/17425-thumb.jpg,https://ncms.nculture.org/pavilion/story/2325,충청북도,영동군,충청북도 영동군 상촌면 하도대3안길 33-18,36.1347,127.895396,20181116,남사고,,"누정, 정자, 누각, 옥계서당, 남사고, 고성남씨, 신흠, 상촌잡록, 권극례, 김윤신, 남사고비결, 격암유록, 남격암십승지론, 정감록, 선택기요, 황여일, 이재, 김하구, 화수루",20211230
2711,일제에 의하여 대한제국 군대가 강제로 해산된 군대해산,국난극복,의병,지방의 역사,일제강점기,한말 의병,한말 정미의병의 배경,"일제는 1907년 7월 19일 고종을 강제로 퇴위시키고, 24일 정미7조약을 체결하여 국권을 강탈한 후 31일 자주국방의 근원인 군부를 폐지하고 군대마저 해산시켰다. 일제는 순종에게 대한제국 군대의 해산에 대한 황제의 조칙을 반포하게 하여 친일파 이완용과 군부대신 이병무를 내세워 ‘군사제도를 쇄신하여 강력한 군대를 양성’하기 위한다는 명목으로 한국군을 해산하였다.",,https://ncms.nculture.org/righteous-army/story/3950,,,,,,20181116,남상덕,대한제국군전투지 서울시가,"대한제국군, 정미7조약, 동대문훈련원, 원주진위대, 강화분견대",20211230
